{
  "$schema": "https://json-schema.org/draft/2020-12/schema",
  "$id": "https://cluck-in.example/schemas/v1/external-event.schema.json",
  "title": "ExternalEvent",
  "description": "Normalized timed calendar event. All-day events are deferred.",
  "type": "object",
  "additionalProperties": false,
  "required": [
    "id",
    "source",
    "title",
    "startTime",
    "endTime"
  ],
  "properties": {
    "id": {
      "type": "string",
      "minLength": 1,
      "description": "Stable opaque event identifier, unique across event sources."
    },
    "source": {
      "type": "string",
      "enum": [
        "google-calendar"
      ]
    },
    "title": {
      "type": "string",
      "minLength": 1
    },
    "description": {
      "type": [
        "string",
        "null"
      ]
    },
    "startTime": {
      "type": "string",
      "format": "date-time"
    },
    "endTime": {
      "type": "string",
      "format": "date-time",
      "description": "Exclusive end time; must be later than startTime. This relationship is checked by the consumer."
    },
    "location": {
      "type": [
        "string",
        "null"
      ],
      "minLength": 1
    },
    "attendees": {
      "type": "array",
      "items": {
        "type": "string",
        "minLength": 1
      },
      "uniqueItems": true,
      "description": "Normalized attendee labels (display names or email addresses), not provider attendee objects. Omitted means unknown; [] means no attendees."
    },
    "metadata": {
      "type": "object",
      "additionalProperties": true,
      "description": "Optional normalized extension fields. Do not include raw provider API objects or credentials."
    }
  }
}
